"","X","Lokacija.","Vrsta.nekretnine.","Ukupan.broj.soba.","Toaleti.","Ukupno.katova.","Cijena.","Površina.","Okućnica.","Godina.izgradnje.","Nekretnina..stanje..","Razred.energetske.učinkovitosti.","Lift.","Pristup.invalidima.","Nekretnina.se.prodaje.iznajmljuje.","Visina.plafona.","Namjena.poslovnog.prostora.","P.P..sa.izlogom.","Pristup.kamionima.šleperima.","Struja.","Parking.","Parking..broj..","Natkriveni.parking.","Povlašteni.parking.","Garaža.","Pogled.na.more.","Pogled.na.","Udaljenost.od.mora.","Ključ.u.agenciji.","naziv","opis","dodatne_oznake","Spavaće.sobe.","Kupaonice.","Površina.balkona.lođe.terase.","Roštilj.","Bazen."
"1878","http://www.remax-svijetnekretnina.com/stan/pula-stoja-trosoban-stan-sa-garazom-na-odlicnoj-lokaciji","Stoja, Pula","Stan/Apartman",4,NA,4,"115.000 € (853.970 kn)","73,60 m2","zajednička na korištenje","1985 god.","dovršena","U izradi","ne","","nenamještena","","","","","","da","","ne","","da","ne","","500-1000m","Ne","Pula, Stoja, trosoban stan sa garažom na odličnoj lokaciji  (ID: 300041070-105)","
                        Pula, Stoja, prodaje se stan sveukupne kvadrature 73,6 m2 smješten u visokom prizemlju zgrade od ukupno 4 kata. 
Stan je odličnog rasporeda, a čine ga ; hodnik, dnevni boravak, dvije spavaće sobe, kuhinja sa blagavaonicom, lođa, ostava i kupatilo koje je renovirano prije 5 godina. 
Također, u cijenu stana prodaje se i garaža površine 17,32 m2. Stan je na odličnoj lokaciji jer se nalazi u blizioni svih potrebnih sadržaja.. market,mesnica,apoteka,javni prijevoz,pošta,banka..a udaljenost od plaža i predivne šetnice Lungo Mare svega je  600 metara.                    ","['Klasično', 'Drva', 'Plin', 'nema otvoren pogled', 'Jug', 'Zapad', 'U mirnoj ulici', 'U blizini javnog prijevoza', 'U blizini škole/vrtića/igrališta', 'U blizini trgovine', 'U blizini bolnice', 'U blizini crkve', 'U blizini mora/plaže', 'U blizini parka/šume']",3,NA,"","","nema"
"1879","http://www.remax-svijetnekretnina.com/apartman/istrabarbariga-simpatican-renovirani-apartman-sa-terasom","Barbariga, Vodnjan","Stan/Apartman",3,NA,3,"89.000 € (660.898 kn)","66 m2","nema okućnice","1989 god.","dovršena","U izradi","ne","da","djelomično namještena","","","","","","ne","","ne","","ne","ne","","500-1000m","Ne","Istra,Barbariga, simpatičan apartman sa terasom u prizemlju (ID: 300041049-550)","
                        Istra,Barbariga, simpatičan apartman sa terasom u prizemlju

Na prodaju je apartman u turističkom naselju Barbariga, koji se nalazi u prizemlju jednokatnice.
Ima ukupno 66m2, od kojih je 30m2 u fazi legalizacije.
Djelomično je namješten i kao takav se i prodaje.
Stambeni dio sastoji se od dnevnog boravka sa kuhinjom i blagovaonom,dvije spavaće sobe, kupatila,i natkrivene terase od 11 m2.

Vrlo ugodno rješenje želite li nekretninu za odmor u blizini mora.                     ","['Kupaonica sa prozorom', 'Kuhinja', 'Balkon/lođa/terasa', 'Struja', 'Voda', 'Komunalije', 'Klima uređaj', 'Struja', 'djelomično otvoren pogled', 'Jug', 'Istok', 'U blizini parka/šume']",2,NA,"11 m2","","nema"
"1904","http://www.remax-svijetnekretnina.com/stan/istra-pula-centar-djelomicno-renovirani-stan-od-9058-m2-na-1-katu","Centar, Pula","Stan/Apartman",4,NA,2,"159.000 € (1.180.706 kn)","90,58 m2","zajednička na korištenje","1900 god.","dovršena","U izradi","ne","ne","namještena","","","","","","ne","","ne","","ne","da","Ulica, grad, luka","2. red","Ne","Istra, Pula, Centar, djelomično renovirani stan od 90,58 m2 na 1. katu (ID: 300041074-77)","
                        Prodaje se djelomično renovirani stan ukupne površine 90,58 m2 na 1. katu starije zgrade, u centru grada i neposrednoj blizini Foruma. Stan se sastoji od 2 dijela i svaki dio ima posebni ulaz sa glavnog stepeništa.Manji dio stana od oko 30 m2 je bio renoviran 2008 i sastoji se od velike sobe sa dnevnim boravkom i malom kuhinjom, kupatilom sa tušem i wc-om,ostavom te dodatnim odvojenim wc-om.Ovaj mali stan je idealan za iznajmljivanje u što se trenutno i koristi.  Drugi dio stana u kojem žive podstanari se sastoji od kuhinje,dnevnog boravka, spavaće sobe sa izlazom na mali balkončić, kupaone, predsoblja, hodnika i terase sa šternom kojom se stanari ovog stana koriste. Ovom dijelu stana je potrebno djelomično renoviranje ali i u sadašnjem stanju je pogodno za stanovanje. Krov na zgradi je promijenjen 2007. godine. Stan ima i dvorište i spremište na korištenje.
Za one koji žele investiciju u nekretninu u samom centru grada sa mnogo potencijala za uređenje i rentanje u turističke svrhe ili za kombinaciju življenja i rentanja, ovaj stan bi mogao biti interesantan.                    ","['Kupaonica sa prozorom', 'Kuhinja sa prozorom', 'Spremište', 'Hodnik', 'Balkon/lođa/terasa', 'Struja', 'Voda', 'Grijanje', 'Pričuva', 'Komunalije', 'Klasično', 'Struja', 'Drva', 'nema otvoren pogled', 'Zapad', 'Istok', 'Centar', 'U blizini glavne ceste / autoputa', 'U blizini javnog prijevoza', 'U blizini škole/vrtića/igrališta', 'U blizini trgovine', 'U blizini bolnice', 'U blizini crkve', 'U blizini mora/plaže']",2,NA,"30 m2","","nema"
"1923","http://www.remax-svijetnekretnina.com/stan/istra-premantura-apartman-59m2","Premantura, Medulin","Stan/Apartman",2,NA,3,"95.000 € 89.000 € (660.898 kn)","59 m2","nema okućnice","2008 god.","dovršena","U izradi","ne","ne","namještena","","","","","","da","","ne","ne","ne","ne","","300-500m","Da","ISTRA, PREMANTURA, APARTMAN 59m2 (ID: 300041048-287)","
                        Premantura, apartman 59 m2 smješten u novijoj stambenoj zgradi. Apartman se nalazi na drugom katu i sastoji se od ulaznog hodnika, spavaće sobe, dnevnog boravka sa kuhinjom i blagovaonom, galerije sa dva spavaća kreveta, kupatila i balkona. Nedaleko od stana nalazi park prirode Kamenjak koji obiluje prekrasnim plažama. U prizemlju zgrade stanu pripada ostava i parkirno mjesto. Stan se prodaje kompletno namješten.                    ","['Struja', 'Voda', 'Klima uređaj', 'Struja', 'Voda', 'Struja', 'djelomično otvoren pogled', 'Sjever', 'Zapad', 'U mirnoj ulici', 'U blizini javnog prijevoza', 'U blizini trgovine', 'U blizini mora/plaže', 'U blizini parka/šume']",2,NA,"","nema","nema"
"1927","http://www.remax-svijetnekretnina.com/stan/krasna-starogradnja-u-strogom-centru-2-parkinga","Centar, Pula","Stan/Apartman",4,1,3,"239.000 € (1.774.772 kn)","154 m2","u vlasništvu","1925 god.","dovršena","U izradi","ne","","namještaj po dogovoru","","","","","","da","2","ne","","ne","ne","","500-1000m","","KRASNA STAROGRADNJA U STROGOM CENTRU - 2 PARKINGA (ID: 300041026-677)","
                        Na  lijepoj lokaciji odmah uz pulsku tržnicu prodaje se stan na prvom katu.
Zgrada je građena 20-ih godina prošlog stoljeća a vlasnici imaju 2 parkirna mjesta u dvorištu.
Stan se sastoji od ulaznog hodnika, 3 spavaće sobe, kupatila, wc-a ,kuhinje s blagovaonom, dnevnog boravka te velike zatvorene lođe i manje terase.
Stan hlade 2 klima uređaja a grijanje je centralno na plin.                    ","['Centralno', 'Klima uređaj', 'Plin', 'nema otvoren pogled', 'Zapad', 'Centar', 'U mirnoj ulici']",3,1,"20 m2","","nema"
"1940","http://www.remax-svijetnekretnina.com/stan/stan-sa-predivnim-pogledom-na-more","Crveni Vrh, Umag","Stan/Apartman",3,1,3,"445.000 € (3.304.491 kn)","112,58 m2","nema okućnice","2005 god.","dovršena","B","da","da","namještena","","","","","","da","","ne","","da","da","","100-300m","Ne","Stan sa predivnim pogledom na more (ID: 300441009-13)","
                        Istra, Crveni Vrh
Prostran stan sa predivnim pogledom na more, smješten u luksuznom naselju Crveni Vrh. Stan je smješten na 2. katu kvalitetne i lijepe zgrade koja je opremljena i liftom. 
Stan sadrži veliki dnevni boravak sa kuhinjom i izlazom na terasu koja pruža panoramski pogled na more,
 2 spavaće sobe, 2 kupatila, wc, ostavu u prizemlju i garažu. Kvalitetno je opremljen i lijepo uređen, udaljen od poznatog Golf terena, mora, marketa, lokala svega par koraka. Odlična lokacija za sve ljubitelje golfa.                    ","['Kupaonica sa prozorom', 'Kuhinja sa prozorom', 'Spremište', 'Hodnik', 'Balkon/lođa/terasa', 'Klima uređaj', 'Struja', 'otvoren pogled', 'Pogled - prekrasan!', 'Sjever', 'Zapad', 'U blizini trgovine', 'U blizini mora/plaže']",2,2,"15.56 m2","","nema"
"1957","http://www.remax-svijetnekretnina.com/stan/pula-luksuzan-stan-na-odlicnoj-lokaciji","Veruda, Pula","Stan/Apartman",2,NA,4,"167.000 € (1.240.112 kn)","76,11 m2","","2017 god.","dovršena","U izradi","da","da","nenamještena","","","","","","da","2","ne","","ne","da","","300-500m","Ne","PULA, LUKSUZAN STAN NA ODLIČNOJ LOKACIJI (ID: 300041070-101)","
                        Prodaje se luksuzan stan na lijepoj lokaciji u zgradi sa 18 stanova koji su još u izgradnji,a trenutno u roh bau izdanju.
Zgrada raspolaže sa jednosobnim i dvosobnim stanovima. Ovaj stan je u prizemlju zgrade i veličine je 59,27 m2 ( sa terasom 76,11m2), a sastoji se od od jedne spavaće sobe, kupatila, hodnika, 
spremišta, kuhinje,dnevnog boravaka i blagovaonice te terase od 16 m2 uz koji dolazi i vrt veličine 40m2 te  ostave u podrumu.
Stanove karakteriziraju velike staklene površine i balkoni/terase, s kojih se pruža predivan panoramski pogled na more.
Kvaliteta gradnje, vrhunski materijali, luksuzna oprema i moderan dizajn,podno grijanje provedeno u cijelom stanu, i ostali detalji
za ugodnije življenje stanu daju dodatnu vrijednost.
U stanu je potrebno postaviti podove koje će investitor staviti kad kupac odabere što bi.

","['Klasično', 'Etažno podno', 'Klima uređaj', 'Struja', 'Plin', 'otvoren pogled', 'Jug', 'U blizini centra', 'U blizini glavne ceste / autoputa', 'U blizini javnog prijevoza', 'U blizini škole/vrtića/igrališta', 'U blizini trgovine', 'U blizini crkve', 'U blizini mora/plaže', 'U blizini parka/šume']",1,NA,"16,64 m2","","nema"
"1972","http://www.remax-svijetnekretnina.com/stan/vrsar-dva-stana-u-prizemlju-s-okucnicom","Vrsar","Stan/Apartman",2,NA,3,"188.700 € (1.401.253 kn)","111 m2","","1972 god.","dovršena","U izradi","ne","uz manju adaptaciju","namještaj po dogovoru","","","","","","ne","","ne","","ne","ne","","300-500m","Ne","VRSAR-dva stana u prizemlju, 400m od mora (ID: 300041078-70)","
                        Prodaje se prizemlje samostojeće kuće u Vrsaru, predivnom ribarskm gradiću. Prizemlje se sastoji od dvije smještajne jedinice, svaka sa posebnim ulazom. Jedan stan je u potpunosti opremljen te se sastoji od dnevnog boravka s kuhinjom, spavaće sobe, kupatila i ostave. Drugi dio se može adaptirati također u stan s jednom spavaćom sobom.
Prizemlju pripada i okućnica površine 100m2.
Postoji mogućnost kupnje i ostalih stanova u kući.
Ovo je odlična nekretnina za one koji žele boraviti u mirnom mjestu na moru te se usput baviti i iznajmljivanjem.                    ","['Spremište', 'Balkon/lođa/terasa', 'Struja', 'Komunalije', 'Voda', 'Klasično', 'Drva', 'djelomično otvoren pogled', 'Jug', 'Zapad', 'U blizini centra', 'U blizini glavne ceste / autoputa', 'U mirnoj ulici', 'U blizini javnog prijevoza', 'U blizini škole/vrtića/igrališta', 'U blizini trgovine', 'U blizini crkve', 'U blizini mora/plaže', 'U blizini parka/šume']",1,1,"5 m2","","nema"
"1973","http://www.remax-svijetnekretnina.com/stan/vrsar-dva-stana","Vrsar","Stan/Apartman",4,NA,3,"188.700 € (1.401.253 kn)","111 m2","nema okućnice","1972 god.","dovršena","U izradi","ne","","namještaj po dogovoru","","","","","","ne","","ne","","ne","ne","","300-500m","Ne","VRSAR-dva stana  (ID: 300041078-71)","
                        Prodaje se prvi kat samostojeće kuće u Vrsaru, predivnom ribarskm gradiću. Etaža se sastoji od dvije smještajne jedinice, svaka sa posebnim ulazom. Oba stana su u potpunosti opremljena. 
Jedan te se sastoji od dnevnog boravka s kuhinjom, spavaće sobe, kupatila i ostave, dok drugi ima dvije spavaće sobe. Veći stan ima i pripadajuću terasu površine 16m2.
Prizemlju pripada i okućnica površine 100m2.
Ovo je odlična nekretnina za one koji žele boraviti u mirnom mjestu na moru te se usput baviti i iznajmljivanjem.                    ","['Spremište', 'Balkon/lođa/terasa', 'Struja', 'Voda', 'Klasično', 'Drva', 'otvoren pogled', 'Jug', 'Zapad', 'U blizini centra', 'U blizini glavne ceste / autoputa', 'U mirnoj ulici', 'U blizini javnog prijevoza', 'U blizini škole/vrtića/igrališta', 'U blizini trgovine', 'U blizini crkve', 'U blizini mora/plaže', 'U blizini parka/šume']",3,2,"16 m2","","nema"
"1974","http://www.remax-svijetnekretnina.com/stan/vrsar-stan-s-terasom","Vrsar","Stan/Apartman",2,NA,3,"136.000 € (1.009.912 kn)","80 m2","nema okućnice","1972 god.","dovršena","U izradi","ne","","namještaj po dogovoru","","","","","","ne","","ne","","ne","da","","300-500m","Ne","VRSAR-stan s terasom  (ID: 300041078-72)","
                        Prodaje stan na drugom katu samostojeće kuće u Vrsaru, predivnom ribarskm gradiću. Stan je površine 80m2 te je u potpunosti opremljen. Sastoji od dnevnog boravka s kuhinjom, spavaće sobe, kupatila i velike terase s pogledom na more i stari grad.
Postoji mogućnost kupnje i ostalih stanova u kući.
Ovo je odlična nekretnina za one koji žele boraviti u mirnom i romantičnom mjestu na moru.                    ","['Balkon/lođa/terasa', 'Struja', 'Komunalije', 'Voda', 'Klasično', 'Drva', 'otvoren pogled', 'Pogled - prekrasan!', 'Jug', 'Zapad', 'U blizini centra', 'U blizini glavne ceste / autoputa', 'U mirnoj ulici', 'U blizini javnog prijevoza', 'U blizini škole/vrtića/igrališta', 'U blizini trgovine', 'U blizini crkve', 'U blizini mora/plaže', 'U blizini parka/šume']",1,1,"14 m2","","nema"
"1975","http://www.remax-svijetnekretnina.com/stan/istraistramarcana-stan-3548m2-i-vrt-258m2","Marčana","Stan/Apartman",2,NA,2,"45.000 € (334.162 kn)","35,48 m2","","1991 god.","dovršena","U izradi","ne","uz manju adaptaciju","djelomično namještena","","","","","","da","2","ne","","ne","ne","","više od 1km","Ne","Istra,Marčana, stan 35,48m2 i vrt 258m2 (ID: 300041049-531)","
                        Istra,Marčana, stan 35,48m2 i vrt 258m2

Na prodaju je stan koji se nalazi u kući sa još dva stana.Nalazi se u prizemlju i ukupne je kvadrature 35,48 m2 sa vrtom od 258 m2.
Stan ima veliki dnevni boravak sa blagovaonom, te odvojenu kuhinju , jednu spavaću sobu, kupatilo i hodnik.

Prodaje se u djelomično namješten.                    ","['Kupaonica sa prozorom', 'Kuhinja sa prozorom', 'Struja', 'Voda', 'Komunalije', 'nema', 'Struja', 'nema otvoren pogled', 'Istok', 'U blizini centra', 'U blizini javnog prijevoza', 'U blizini trgovine']",1,NA,"","","nema"
"1976","http://www.remax-svijetnekretnina.com/stan/istramarcana-stanvrt-225m2garaza-50m2","Marčana","Stan/Apartman",2,NA,2,"105.000 € (779.711 kn)","62,55 m2","u vlasništvu","1991 god.","dovršena","U izradi","ne","da","namještena","","","","","","da","2","ne","","da","ne","","više od 1km","","Istra,Marčana, stan,vrt 225m2,garaža 50m2 (ID: 300041049-530)","
                        Istra,Marčana, stan,vrt 225m2,garaža 50m2

Na prodaju je stan koji se nalazi u kući sa još dva stana.Nalazi se u prizemlju i ukupne je kvadrature  62,55m2 sa terasom od 24,72m2, vrtom od 225m2, te novoizgrađenom garažom od 50m2.
Stan ima veliki dnavni boravak u kojem se nalazi kamin na drva, te izlaz na terasu,kuhinju sa blagovaonom, jednu spavaću sobu, kupatilo , hodnik i malo spremište.

Prodaje se u potpunosti namješten,dok nova garaža od 50m2, bi lako bila pretvorena u još jedan stan.                    ","['Struja', 'Voda', 'Komunalije', 'Klasično', 'Drva', 'nema otvoren pogled', 'Jug', 'Istok', 'U blizini centra', 'Centar', 'U blizini javnog prijevoza']",1,1,"24.72 m2","","nema"
"1980","http://www.remax-svijetnekretnina.com/stan/vrsar-stan-u-prizemlju-s-okucnicom","Vrsar","Stan/Apartman",3,1,4,"195.000 € (1.448.035 kn)","85 m2","","2001 god.","dovršena","U izradi","ne","da","nenamještena","","","","","","da","2","ne","","da","ne","","500-1000m","Ne","VRSAR-stan u prizemlju s okućnicom (ID: 300041078-68)","
                        Prodaje se stan u Vrsaru površine 85m2 sa okućnicom od 250 m2. Smješten je u prizemlju zgrade sa četiri kata, na udaljenosti od  700m od mora.
Stan se sastoji od velikog dnevnog boravka s blagavaonom i kuhinjom, dvije spavaće sobe, kupatila i wc-a. U dvorištu se nalaze garaža i velika odtava.
Ovo je idealna prilika za najam ili boravak u predivnom turističkom gradiću blizu mora.                    ","['Spremište', 'Struja', 'Voda', 'Komunalije', 'Etažno centralno', 'Klima uređaj', 'Struja', 'Lož ulje', 'djelomično otvoren pogled', 'Zapad', 'Predgrađe', 'U blizini glavne ceste / autoputa', 'U mirnoj ulici', 'U blizini škole/vrtića/igrališta', 'U blizini trgovine', 'U blizini crkve', 'U blizini mora/plaže', 'U blizini parka/šume']",2,1,"27 m2","","nema"
"1996","http://www.remax-svijetnekretnina.com/stan/istrarovinj-stan-u-centru","Rovinj","Stan/Apartman",3,NA,3,"165.000 € (1.225.261 kn)","54 m2","nema okućnice","1900 god.","dovršena","U izradi","ne","","namještaj po dogovoru","","","","","","ne","","ne","","ne","ne","","100-300m","Ne","ISTRA,ROVINJ - STAN U CENTRU (ID: 300041070-92)","
                        U ponudi je stan u  jezgri Rovinja na predivnoj poziciji, ukupne površine 54 m2. Stan se sastoji od kuhinje s blagovaonom, dnevnog boravka, kupaone, ostave i dvije spavaće sobe. 
Stan se nalazi na prvom katu autohtone zgrade. Na zgradi je nedavno promijenjen krov i postavljena je termo izolacija. Nova donja i gornja betonska ploča, a u stanu su nove instalacije struje i vode.  Zbog svoje odlične pozicije- blizine centra,tržnice,dućana i blizine plaže i šetnice predstavlja odličnu investiciju za iznajmljivanje u turističke svrhe kao i za obitelji koje traže stan u blizini svih sadržaja.                    ","['Struja', 'Voda', 'Pričuva', 'Klima uređaj', 'Struja', 'djelomično otvoren pogled', 'Zapad', 'Istok', 'Centar', 'U blizini javnog prijevoza', 'U blizini škole/vrtića/igrališta', 'U blizini trgovine', 'U blizini mora/plaže']",2,NA,"","","nema"
"1999","http://www.remax-svijetnekretnina.com/stan/medulin-dvosoban-apartman-stan","Medulin","Stan/Apartman",3,NA,3,"99.900 € (741.840 kn)","71,11 m2","nema okućnice","2010 god.","dovršena","U izradi","ne","ne","nenamještena","","","","","","da","3","ne","","ne","ne","","više od 1km","","MEDULIN, DVOSOBAN APARTMAN-STAN  (ID: 300041070-89)","
                        Istra, Medulin, apartman ili stan od 71,11 m2 nalazi se u prizemlju manje stambene zgrade a sastoji se od ulaznog hodnika, kupatila, kuhinje sa blagovaonom i 
dnevnim boravkom te dvije spavaće sobe i ostave. 
Stanu pripadaju 3 parkirna mjesta,te postoji mogućnost od dva napraviti vanjsku terasu što su vlasnici imali na umu jer i u vlasničkom listu taj dio slovi kao kućni vrt.
Zbog svoje mirne lokacije stan/apartman je idealan za življenje tokom godine ili odmor tokom ljetnih mjeseci. 
","['Klasično', 'Klima uređaj', 'Struja', 'Drva', 'nema otvoren pogled', 'Jug', 'Istok', 'U blizini glavne ceste / autoputa', 'U blizini javnog prijevoza', 'U blizini škole/vrtića/igrališta', 'U blizini trgovine']",2,NA,"","","nema"
"2021","http://www.remax-svijetnekretnina.com/stan/kvalitetan-penthouse-u-rovinju-blizina-plaze","Rovinj","Stan/Apartman",5,NA,3,"na upit","260 m2","u vlasništvu","2017 god.","dovršena","A+","da","da","nenamještena","","","","","","da","","da","ne","da","ne","","300-500m","Ne","KVALITETAN PENTHOUSE U ROVINJU - BLIZINA PLAŽE (ID: 300041026-666)","
                        Na prekrasnoj lokaciji u Rovinju svega 500 m od prelijepih plaža prodaju se luksuzni stanovi /apartmani .
Zgrada je građena od najkvalitetnijih materijala, betonske je konstrukcije i protupotresne građe sa 15 cm izolacijom s vanjske strane te postiže energetski razred A+.
Velika pažnja posvećena je termo, zvučnoj i hidro izolaciji koristeći najpoznatije i najkvalitetnije materijale poput Rofix, Knauf, Sika.
Iz garaže, u koju se ulazi po pažljivo uređenoj rampi za koju su se koristili autohtoni materijali  poput istarskog kamena, uvažavajući karakteristike autohtone arhitekture ulazi se  u stambeni dio uz mogućnost korištenja lifta.
Lift u jednom dijelu ima panoramski efekt.
Svaki stan ima zasebnu vodu, struju, grijanje i hlađenje. 
Za sustav dovoda vode korištena su najkvalitetnija Geberit Mepla riješenja, za odvodnju Geberit silent a za mješalice vode Hansgrohe. 
Struja je pokrivena VIMAR sistemom. 
Grijanje i hlađenje je Mitschubischi autonomna dizalica topline sa mogućnošću grijanja putem zraka i podno grijanje i hlađenje putem zraka (hotelski efekt kroz kanale i alu. rešetke).
 Uz grijanje i hlađenje postoji i zaseban uređaj izmjenjivača zraka tzv. ventilokonvertor. 
Svaki stan ima i kamin na drva sa zasebnim dimnjakom i zasebnu ventilaciju.
Svi prozrori su ALU marke SCHUCO s aposebnim SOLAR staklima. ALU rolete se spuštaju i dižu automatski pomoću SOMFY motora na dalj.uptavlj.
 Krov je napravljen od posebnih materijala izrazito visoke kvalitete sa završnim slojem Riverklack boje patine bakra. Na objektu neće biti vidljive odvodne cijevi jer su sv ukorporirane u fasadu te s te strane zgrade ima ravne i čiste linije sa kamenom vertikalom suhozida i nadvoja iznad prozora rađenim u posebnim tehnikama.
 Završni slojevi biti će pokriveni u talijanskoj keramici i kvalitetnim drvom. 
Svaka terasa imam dovod vode i struju.

Na raspolaganju su sljedeće kvadrature : 2 kat dvoetažni stanovi 211 m2 i 260 m2


Dogovor oko parkirnih i garažnih mjesta je s investitorom.                    ","['Centralno', 'Struja', 'Struja', 'otvoren pogled', 'Jug', 'Zapad', 'U blizini centra', 'U mirnoj ulici', 'U blizini trgovine', 'U blizini mora/plaže']",3,2,"","nema","nema"
"2026","http://www.remax-svijetnekretnina.com/apartman/istra-premantura-apartman-6262-m2-u-blizini-rta-kamenjak","Premantura, Medulin","Stan/Apartman",3,1,2,"120.000 € (891.099 kn)","62,62 m2","nema okućnice","2000 god.","dovršena","B","ne","ne","namještena","","","","","","da","1","ne","","ne","da","Naselje, prirodu","300-500m","","Istra, Premantura, apartman 62,62 m2 u blizini Rta Kamenjak (ID: 300041074-50)","
                        Prodaje se zgodno pozicioniran apartman, u novijoj zgradi u blizini Rta Kamenjak koji ima galeriju i terasu sa prekrasnim pogledom na more. Apartman se još sastoji od dnevnog boravka,kuhinje, 2 spavaće sobe, kupaonice, balkona,izbe i spremišta u suterenu.Ispred apartmanske zgrade ima dovoljno parkirnih mjesta, a od mora, Rta Kamenjak  i centra Premanture je udaljena pješačkom distancom.
Apartman se prodaje namješten izuzev nekih slika i drugih ukrasa koji idu po dogovoru.
Ovaj apartman je pogodan za one koji si žele priuštiti kupnju nekretnine sa potencijalom za rentu i zaradu u vrlo popularnom turističkom mjestu i imati priliku sami uživati u okruženju mora i prirode.                    ","['Kupaonica sa prozorom', 'Galerija', 'Kuhinja sa prozorom', 'Spremište', 'Hodnik', 'Balkon/lođa/terasa', 'Struja', 'Voda', 'Pričuva', 'Komunalije', 'Klima uređaj', 'Struja', 'djelomično otvoren pogled', 'Pogled - prekrasan!', 'Jug', 'Zapad', 'U blizini centra', 'U blizini glavne ceste / autoputa', 'U mirnoj ulici', 'U blizini javnog prijevoza', 'U blizini trgovine', 'U blizini crkve', 'U blizini parka/šume']",2,1,"13 m2","","nema"
