"","X","Lokacija.","Vrsta.nekretnine.","Ukupan.broj.soba.","Toaleti.","Ukupno.katova.","Cijena.","Površina.","Okućnica.","Godina.izgradnje.","Nekretnina..stanje..","Razred.energetske.učinkovitosti.","Lift.","Pristup.invalidima.","Nekretnina.se.prodaje.iznajmljuje.","Visina.plafona.","Namjena.poslovnog.prostora.","P.P..sa.izlogom.","Pristup.kamionima.šleperima.","Struja.","Parking.","Parking..broj..","Natkriveni.parking.","Povlašteni.parking.","Garaža.","Pogled.na.more.","Pogled.na.","Udaljenost.od.mora.","Ključ.u.agenciji.","naziv","opis","dodatne_oznake","Spavaće.sobe.","Kupaonice.","Površina.balkona.lođe.terase.","Roštilj.","Bazen."
"967","http://www.remax-svijetnekretnina.com/stan/porec-okolica-stan-na-drugom-katu-s-pogledom-na-more","Tar, Tar-Vabriga","Stan/Apartman",6,1,1,"165.288 € (1.227.399 kn)","137,74 m2","nema okućnice","2008 god.","dovršena","U izradi","ne","ne","nenamještena","","","","","","da","1","ne","ne","ne","da","prekrasan pogled  na more ","više od 1km","Da","Poreč okolica - Stan na drugom katu s pogledom na more (ID: 300391016-96)","
                        Prostran stan površine 129.94 m2, kojemu pripada vanjskom parkirno mjesto površine 3.88 m2, dva spremišta u podrumu zgrade površine od 1.67 m2 i 2.25 m2. 
Stan je smješten je na drugom katu stambene zgrade. Odlična novogradnja (2008.g), u sobama je postavljen hrastov parket u ostalim prostorijama keramika.

RASPORED STANA:
- kuhinja s blagovaonicom i dnevnim boravkom s izlazom na terasu, pet spavaćih soba, dvije kupaonice i dva wc -a, ostava, hodnik,  dvije terase, spremište na tavanu
- spremište u podrumu
- parkirno mjesto

Etažna brojila struje i vode, stan uređen u fazi ""KLJUČ U RUKE"" (potrebno unijeti samo namještaj).
Vanjska PVC stolarija sa škurama, dok je unutarnja stolarija drvena (hrast).

Odlična lokacija zgrade, centar Tara, udaljeno cca 2 km od mora (Camping Lanterna).

Nekretnina je u sustavu PDV - a. 
Fizička osoba ne plaća porez na promet nekretnina!

MOGUĆE KOMBINACIJE:
- dogovor oko cijene
- mogućnost kreditiranja (50% učešća, a razlika putem kredita s povoljnijim uvjetima)
- mogućnost počeka plaćanja
- sve kombinacije otvorene
- ako kao kupac imate bilo kakav prijedlog ili kombinaciju, spremni smo ju uzeti u obzir i razmotriti.                    ","['Galerija', 'Kuhinja sa prozorom', 'Spremište', 'Hodnik', 'Balkon/lođa/terasa', 'Struja', 'Voda', 'Komunalije', 'nema', 'Struja', 'Voda', 'Struja', 'Kanalizacija', 'otvoren pogled', 'Pogled - prekrasan!', 'Zapad', 'U blizini centra', 'U blizini glavne ceste / autoputa', 'U blizini javnog prijevoza', 'U blizini škole/vrtića/igrališta', 'U blizini trgovine', 'U blizini crkve', 'U blizini parka/šume']",5,2,"15 m2","nema","nema"
"970","http://www.remax-svijetnekretnina.com/stan/istrarovinj-stari-graddvoetazni-stan","Rovinj","Stan/Apartman",2,NA,5,"125.000 € (928.228 kn)","50 m2","nema okućnice","1900 god.","dovršena","U izradi","ne","ne","djelomično namještena","","","","","","ne","","ne","","ne","ne","","300-500m","Ne","Istra,Rovinj stari grad,dvoetažni stan (ID: 300041092-2)","
                        Istra,Rovinj stari grad,dvoetažni stan

Stan je smješten na 3. i 4. katu,sa svakom etažom od po 25m2.
Stan je renoviran 2008.god.
Postavljena je PVC stolarija na svim prozorima.
Nalazi se 100m od glavnog trga i 200m od crkve Sv.Eufemije.

Iznimno povoljna prilika s obzirom na lokaciju.                    ","['Galerija', 'Kuhinja', 'Kuhinja sa prozorom', 'Hodnik', 'Vanjska stolarija', 'Instalacije struje', 'Instalacije vode', 'Kupaonica/ kuhinja', 'Pod: parket/laminat/pločice', 'Struja', 'Voda', 'Klima uređaj', 'Struja', 'nema otvoren pogled', 'Sjever', 'U blizini centra', 'Centar', 'U blizini trgovine', 'U blizini crkve', 'U blizini mora/plaže']",1,1,"","","nema"
"980","http://www.remax-svijetnekretnina.com/stan/istra-rovinj-stan-u-centru-rovinja-sa-terasom-i-vrtom","Rovinj","Stan/Apartman",6,2,1,"292.000 € (2.168.340 kn)","96 m2","zajednička na korištenje","1905 god.","dovršena","U izradi","ne","ne","nenamještena","","","","","","ne","","ne","","ne","ne","","100-300m","Ne","Istra, Rovinj, stan u centru Rovinja sa terasom i vrtom (ID: 300041090-39)","
                        Istra, Rovinj, stan od 96 m2 u centru Rovinja sa velikom terasom 25m2. Stan se nalazi na prvom katu zgrade građene početkom 20.stoljeća, u samome centru grada, nadomak svih sadržaja, trgovina, kafića, šetnice, mora, ambulante, škole. Odlična investicija za obitelj koja traži veći stan u centru alii za bavljenje turizmom budući da je od stana moguće napraviti 2 stana sa posebnim ulazom. Stan je potrebno djelomično adaptirati, kupaone i kuhinju. Stan ima svoje vlastito spremište u koje se ulazi iz stana, a sa terase se silazi u dvorište u kojem se nalazi stara šterna. Dvorište je zaklonjeno od vanjskih pogleda što budućem kupcu garantira privatnost. U dvorištu je ulaz u spremište čija je 1/3 u vlasništvu stana. Stan također ima na korištenje 1/3 tavana.                     ","['Kupaonica sa prozorom', 'Kuhinja sa prozorom', 'Spremište', 'Hodnik', 'Balkon/lođa/terasa', 'Vanjska stolarija', 'Unutarnja stolarija', 'Krov', 'Struja', 'Voda', 'Pričuva', 'Komunalije', 'nema', 'Struja', 'Drva', 'Peleti', 'djelomično otvoren pogled', 'Zapad', 'Centar', 'U blizini javnog prijevoza', 'U blizini škole/vrtića/igrališta', 'U blizini trgovine', 'U blizini bolnice', 'U blizini crkve', 'U blizini mora/plaže', 'U blizini parka/šume']",4,1,"25 m2","","nema"
"986","http://www.remax-svijetnekretnina.com/stan/istra-buje-trosobni-stan-s-pogledom-na-piranski-zaljev","Kaštel, Buje","Stan/Apartman",5,NA,1,"150.000 € (1.113.873 kn)","87 m2","zajednička","2010 god.","dovršena","B","ne","ne","namještena","","","","","","da","","ne","ne","da","da","Piranski Zaljev","više od 1km","Ne","ISTRA, BUJE - Trosobni stan s pogledom na Piranski Zaljev (ID: 300041093-18)","
                        Prodaje se trosobni apartman površine 87,11 m2 u mirnom i lijepom naselju pokraj Kaštela, Buje, nadomak glavne ceste Buje-Koper-Trst. Nalazi se na prvom katu zgrade sa ukupno 4 stana. Sastoji se od hodnika, dvije spavaće sobe, dvije kupaone, kuhinje i blagovaonice. Pripada mu garaža u prizemlju. Stan je potpuno opremljen sa namještajem i inventarom te se tako i prodaje. Grijanje je podno, etažno no postoji i peć na peć na drva za posebno lijepi ugođaj. Na terasu se može izaći iz dnevnog boravka i iz spavaće sobe, a sa terase se pogled kroz zelenu borovu šumu širi i na Piranski Zaljev, odnosno jadransko more. Iznimno mirna i atraktivna lokacija u blizini svih sadržaja pružit će budućem vlasniku lagodan život.                    ","['Kupaonica sa prozorom', 'Galerija', 'Kuhinja', 'Kuhinja sa prozorom', 'Spremište', 'Hodnik', 'Balkon/lođa/terasa', 'Klasično', 'Centralno', 'Etažno podno', 'Struja', 'Drva', 'Voda', 'otvoren pogled', 'Pogled - prekrasan!', 'Jug', 'Zapad', 'U blizini centra', 'U blizini glavne ceste / autoputa', 'U mirnoj ulici', 'U blizini javnog prijevoza', 'U blizini škole/vrtića/igrališta', 'U blizini trgovine', 'U blizini bolnice', 'U blizini crkve', 'U blizini mora/plaže', 'U blizini parka/šume', 'U blizini jezera/rijeke/potoka']",2,2,"8 m2","nema","nema"
"988","http://www.remax-svijetnekretnina.com/stan/rovinj-prostran-stan-na-lijepoj-lokaciji","Rovinj","Stan/Apartman",4,NA,3,"250.000 € (1.856.456 kn)","96,50 m2","zajednička na korištenje","1990 god.","dovršena","U izradi","ne","ne","namještaj po dogovoru","","","","","","da","","ne","","ne","ne","","više od 1km","Ne","Rovinj, prostran stan na lijepoj lokaciji (ID: 300391008-245)","
                        U bližem centru Rovinja, u mirnoj ulici prodaje se stan od 96,50m2.
Stan se sastoji od ulaznog hodnika, 3 spavaće sobe, jednog kupatila i manjeg wc-a.
Dugačak hodnik vodi u dnevni boravak, kuhinju i blagavaonu.
Tu se nalazi i jedno manje spremište.
Iz dnevnog boravka izlazi se na zatvorenu terasu i odmah se nalazi još jedna otvorena.
Stan koristi i dio zajedničke okučnice iz koje se može ući u stan.
Stanu pripada i spremište.

","['Kuhinja', 'Spremište', 'Hodnik', 'Balkon/lođa/terasa', 'Klasično', 'Struja', 'Drva', 'djelomično otvoren pogled', 'Istok', 'U blizini centra', 'U mirnoj ulici', 'U blizini trgovine']",3,NA,"","","nema"
"999","http://www.remax-svijetnekretnina.com/stan/istra-okolica-pule-vodnjan-stan-u-centru-grada","Vodnjan","Stan/Apartman",4,1,3,"105.000 € 95.000 € (705.453 kn)","58,61 m2","nema okućnice","1900 god.","dovršena","U izradi","ne","ne","namještena","","","","","","ne","","ne","","ne","ne","naselje,grad","više od 1km","Ne","Istra, okolica Pule, Vodnjan, stan u centru grada (ID: 300041074-204)","
                        Prodaje se stan u zgradi u nizu, u centru grada Vodnjana. Stan se sastoji od 3 sobe i kuhinje blagovaone raspodijeljene na 2 kata te prizemlja sa uređenom konobom u 2 dijela i kupatilom. Jedan dio je ulazno predvorje sa umjetničkim eksponatima,a drugi je prostor za druženje uz kamin. 
Stan je jako ukusno uređen, ima lijepu krovnu terasu sa pogledom prema Brijunima ali i Učki kroz krovove naselja. Kamin je u prizemlju za zimski ugođaj topline, a stan je idealan za nekoga tko želi imati nekretninu u blizini morskih plaža (Peroj, Fažana, Valbandon) najbliže su udaljene  4 km. Sva potrebna infrastruktura malog grada je dostupna bez upotrebe automobila.                    ","['Kupaonica sa prozorom', 'Kuhinja sa prozorom', 'Spremište', 'Hodnik', 'Balkon/lođa/terasa', 'Struja', 'Voda', 'Klasično', 'Drva', 'nema otvoren pogled', 'Zapad', 'Istok', 'Centar', 'U blizini glavne ceste / autoputa', 'U blizini javnog prijevoza', 'U blizini škole/vrtića/igrališta', 'U blizini trgovine', 'U blizini crkve', 'U blizini parka/šume']",2,1,"15 m2","","nema"
"1002","http://www.remax-svijetnekretnina.com/apartman/istra-barbariga-apartman-u-prizemlju-sa-vrtom","Barbariga, Vodnjan","Stan/Apartman",3,NA,1,"93.600 € (695.057 kn)","55 m2","","1990 god.","dovršena","U izradi","ne","da","namještena","","","","","","da","1","da","","ne","ne","","300-500m","Da","Istra, Barbariga apartman u prizemlju sa vrtom (ID: 300041090-37)","
                        Istra, Barbariga prodaje se apartman u prizemlju sa vrtom. Stan se sastoji od ulaznog hodnika, 2 spavaće sobe, kuhinje, kupaone, zimskog vrta koji može služiti i kao dnevni boravak, prednjeg i straženjeg dvorišta. Stan ima vlastito parkirno mjesto koje se nalazi ispred samog ulaza u prednje dvorište. Ova nekretnina ne dijeli krov sa ostalimn stanarima te postoji mogućnost nadogradnje kata. Stan ima i dvije ostave, jednu u stanu manju, i vanjsku veću u koju je moguće odlagati i veće stvari. Udaljena od plaže nekoliko minuta pješke. Prodaje se u cijelosti namješten.                    ","['Kuhinja sa prozorom', 'Hodnik', 'Balkon/lođa/terasa', 'Struja', 'Voda', 'Komunalije', 'Klasično', 'Struja', 'Drva', 'djelomično otvoren pogled', 'Jug', 'U blizini glavne ceste / autoputa', 'U mirnoj ulici', 'U blizini javnog prijevoza', 'U blizini trgovine', 'U blizini mora/plaže', 'U blizini parka/šume']",2,1,"","","nema"
"1005","http://www.remax-svijetnekretnina.com/stan/buje-stan-u-novogradnji-u-starom-gradu2","Buje","Stan/Apartman",4,NA,2,"na upit","52 m2","nema okućnice","2017 god.","nedovršena","U izradi","ne","ne","nenamještena","","","","","","da","","ne","","ne","ne","","više od 1km","Ne","BUJE STAN U NOVOGRADNJI U STAROM GRADU (ID: 300441009-30)","
                        U starogradskoj jezgri grada Buja, prodaje se stan od 52 m2. Stan je potpunosti nov i vrlo kvalitetno građen.
Prodaje se dovršen, izuzev keramike, te u ovoj fazi kupac ima mogućnost izabrati keramiku, podove po želji.
Vrlo dobra prilika za investiciju jer je stan idealan za život kao i za iznajmljivanje.
","['Kuhinja sa prozorom', 'Struja', 'Voda', 'Komunalije', 'nema', 'Struja', 'nema otvoren pogled', 'Sjever', 'Istok', 'Centar', 'U blizini glavne ceste / autoputa', 'U mirnoj ulici', 'U blizini javnog prijevoza', 'U blizini škole/vrtića/igrališta', 'U blizini trgovine', 'U blizini bolnice', 'U blizini crkve']",2,NA,"","","nema"
"1011","http://www.remax-svijetnekretnina.com/stan/istra-vabriga-stan-u-novogradnji-s-okucnicom","Vabriga, Tar-Vabriga","Stan/Apartman",3,NA,2,"138.000 € (1.024.764 kn)","69 m2","","2017 god.","dovršena","B","ne","ne","nenamještena","","","","","","da","1","ne","","ne","da","","više od 1km","Da","Istra,Tar - Vabriga - Stan u novogradnji s okućnicom (ID: 300391016-81)","
                        U prodaji je stan u malom ribarskom mjestu, koji sa svim svojim sadržajima (restorani, trgovine, škola, vrtić, ljekarna ) pruža maksimalne mogućnosti za kvalitetan život. 
Stan se nalazi na prvom katu zgrade s četiri stana. Stan se sastoji od predsoblja, dnevnog boravka, kuhinje s blagovaonom, dvije spavaće sobe i kupaone. Također stan ima svoju terasu s koje se pruža prekrasan pogled. Stan je u novogradnji, tako da je u tijeku ishodovanje uporabne i etažiranje, u kojem će svaki stan imati svoj dio okućnice i svoje parkirno mjesto upisano u vlasništvo. Stan se prodaje nenamješten. Sve dodatne preinake moguće su u dogovoru s investitorom.                    ","['Kuhinja', 'Kuhinja sa prozorom', 'Spremište', 'Balkon/lođa/terasa', 'Klasično', 'Klima uređaj', 'Struja', 'otvoren pogled', 'Zapad', 'Istok', 'U mirnoj ulici', 'U blizini trgovine']",2,1,"7 m2","","nema"
"1012","http://www.remax-svijetnekretnina.com/stan/istra-vabriga-stan-u-prizemlju-s-okucnicom","Vabriga, Tar-Vabriga","Stan/Apartman",3,NA,2,"134.000 € 125.000 € (928.228 kn)","67 m2","ima","2017 god.","dovršena","B","ne","uz manju adaptaciju","nenamještena","","","","","","da","1","ne","ne","ne","da","","više od 1km","Da","Istra, Tar - Vabriga - Stan u prizemlju 67 m2 (ID: 300391016-80)","
                        U prodaji je stan u malom ribarskom mjestu, koji sa svim svojim sadržajima (restorani, trgovine, škola, vrtić, ljekarna ) pruža maksimalne mogućnosti za kvalitetan život. 
Stan se nalazi u prizemlju zgrade s četiri stana. Stan se sastoji od predsoblja, dnevnog boravka, kuhinje s blagovaonom, dvije spavaće sobe i kupaone. Stan je u novogradnji, tako da je u tijeku ishodovanje uporabne i etažiranje, u kojem će svaki stan imati svoj dio okućnice i svoje parkirno mjesto upisano u vlasništvo. Stan se prodaje nenamješten. Sve dodatne preinake moguće su u dogovoru s investitorom.                     ","['Kuhinja', 'Kuhinja sa prozorom', 'Spremište', 'Balkon/lođa/terasa', 'Klasično', 'Klima uređaj', 'Struja', 'Voda', 'Struja', 'Kanalizacija', 'Optički kabel', 'Parlafon', 'otvoren pogled', 'Pogled - prekrasan!', 'Jug', 'Zapad', 'U blizini centra', 'U mirnoj ulici', 'U blizini trgovine']",2,1,"7 m2","nema","nema"
"1015","http://www.remax-svijetnekretnina.com/stan/istra-fazana-centar-stan-2ss-100m-od-mora","Fažana","Stan/Apartman",3,NA,2,"129.000 € 120.000 € (891.099 kn)","60,47 m2","zajednička na korištenje","1958 god.","dovršena","U izradi","ne","ne","namještaj po dogovoru","","","","","","da","","ne","","ne","ne","","100-300m","Ne","Istra, Fažana CENTAR, Trosoban stan - 100M OD MORA (ID: 300041091-6)","
                        Istra, Fažana CENTAR, Trosoban stan - 100M OD MORA

U turističkom mjestu Fažana smještenom nasuprot Brijunskom otočju prodaje se stan sa dvije spavaće sobe. 

Fažana je mjesto okruženo prekrasnim šljunčanim plažama te poznatom nekoliko kilometara dugom šetnicom od kampa Valbandon pa skoro do Peroja. 
Centar mjesta sa svojim uskim cesticama i prekrasnom rivom čini Fažanu jednom od najljepših gradova Istre.
Stan je smješten u samom srcu starogradske jezgre, svega nekoliko koraka od plaže, popularne šetnice i crkve Sv Kuzme i Damjana.
 U okolici objekta dostupni su razni sadržaji, restorani i barovi.

Stan se nalazi na drugom katu i sastoji se od spremišta, dnevnog boravka, kuhinje, 2 velike spavaće sobe, kupaonice i balkona,  površine 60.47m2.

Nekretnina sa odličnom pozicijom, za uživanje ili kao dodatni prihod.                     ","['Kupaonica sa prozorom', 'Kuhinja sa prozorom', 'Spremište', 'Balkon/lođa/terasa', 'Struja', 'Voda', 'Plin', 'Pričuva', 'Klasično', 'Klima uređaj', 'Struja', 'Drva', 'djelomično otvoren pogled', 'Zapad', 'Centar', 'U blizini glavne ceste / autoputa', 'U mirnoj ulici', 'U blizini javnog prijevoza', 'U blizini škole/vrtića/igrališta', 'U blizini trgovine', 'U blizini crkve', 'U blizini mora/plaže', 'U blizini parka/šume']",2,NA,"5 m2","","nema"
"1025","http://www.remax-svijetnekretnina.com/stan/istra-pula-dvosoban-stan-novo-u-ponudi","Monvidal, Pula","Stan/Apartman",3,NA,4,"83.000 € (616.343 kn)","69 m2","nema okućnice","2009 god.","dovršena","U izradi","ne","ne","namještena","","","","","","ne","","ne","ne","ne","ne","","više od 1km","Da","Istra, Pula, novi 2-SS,4 kat bez lifta ,potkrovlje (ID: 300041056-242)","
                        Istra, Pula, novi 2-SS,4 kat bez lifta ,potkrovlje

Prodaje se dvosoban stan veličine 69 m2 u Puli, naselje Monvidal. Sastoji se od ulaznog prostora povezanim sa većim dnevnim boravkom i kuhinjom, dvije spavaće sobe, kupatila i balkona. Nalazi se na zadnjem katu(4.) novije zgrade. Grijanje je centralno na plin. Stan se prodaje namješten.                     ","['Struja', 'Voda', 'Grijanje', 'Plin', 'Pričuva', 'Komunalije', 'Etažno centralno', 'Plin', 'Voda', 'Struja', 'Plin', 'Parlafon', 'djelomično otvoren pogled', 'Sjever', 'U mirnoj ulici', 'U blizini javnog prijevoza', 'U blizini škole/vrtića/igrališta', 'U blizini trgovine', 'U blizini parka/šume']",2,NA,"","nema","nema"
"1026","http://www.remax-svijetnekretnina.com/stan/vabriga-atraktivan-stan-u-blizini-mora","Vabriga, Tar-Vabriga","Stan/Apartman",2,NA,3,"147.000 € (1.091.596 kn)","44,47 m2","zajednička","2008 god.","dovršena","U izradi","ne","ne","namještena","","","","","","da","2","ne","","ne","ne","","500-1000m","Da","VABRIGA, ATRAKTIVAN STAN U BLIZINI MORA (ID: 300391017-60)","
                        U turistički poznatom mjestu Vabriga nalazi se ovaj vrlo atraktivan stan. Od mora udaljen je svega nekoliko stotina metara. Smješten je u novijoj stambenoj zgradi na 1. katu. Do mora stiže se za 5 min pješke. Do grada Poreča svega je 10 min vožnje. Stan se sastoji od ulaznog hodnika, vrlo lijepe kuhinje sa blagovaonicom iz koje se izlazi na prostranu terasu, sa koje sepruža otvoren pogled na okolno zelenilo i okolne kuće.  Manji hodnik dijeli dnevni dio stana sa spavaćom sobom i kupaonicom. Ono što bi trebalo posebno istaknuti je da je stan vrlo ukusno namješten, te da se vodila briga o ugodnosti boravka i detaljima pri odabiru interijera. Stanu pripada veliko parkirno mjesto od 21,26m2, te spremište od 3,91m2. Posebno ističemo da stanu pripada i korištenje vanjskog bazena, koji pripada svim stanarima. Lijepom zelenom živicom odvojen je od pogleda, te zadržava svoju intimnost boravka. 

IZUZETNO INTERESANTNA NEKRETNNA , ZBOG POZICIJE IDEALNA JE ZA BAVLJENJE TURIZMOM.                    ","['Kuhinja', 'Kuhinja sa prozorom', 'Spremište', 'Hodnik', 'Balkon/lođa/terasa', 'Struja', 'Voda', 'Grijanje', 'Pričuva', 'Komunalije', 'Klasično', 'Klima uređaj', 'Struja', 'djelomično otvoren pogled', 'Jug', 'Zapad', 'U blizini centra', 'U mirnoj ulici', 'U blizini javnog prijevoza', 'U blizini trgovine', 'U blizini crkve', 'U blizini mora/plaže', 'U blizini parka/šume']",1,1,"","","na korištenje"
"1031","http://www.remax-svijetnekretnina.com/stan/stan-za-djelomicnu-adaptaciju","Smoljanci, Svetvinčenat","Stan/Apartman",3,NA,NA,"80.000 € (594.066 kn)","66,17 m2","","1968 god.","dovršena","U izradi","ne","uz manju adaptaciju","namještaj po dogovoru","","","","","","da","","ne","","ne","da","","više od 1km","Ne","Stan za djelomičnu adaptaciju (ID: 300391008-240)","
                        U samom srcu Istre, nedaleko od srednjovjekovnog grada Savičente, prodaje se stan od 66m2.
Stan se nalazi u mjestu Smoljanci, raspoređen je na tri etaže.
U prizemlju se nalazi dnevni boravak, kuhinja i kupatilo.
Na prvom katu nalaze se dvije spavaće sobe, te ima i potkrovlje.
Ispred stana nalazi se i dio okučnice koji pripada stanu.                    ","['Klasično', 'Struja', 'Drva', 'otvoren pogled', 'Zapad', 'U blizini glavne ceste / autoputa', 'U blizini škole/vrtića/igrališta', 'U blizini trgovine', 'U blizini crkve', 'U blizini parka/šume']",2,NA,"","","nema"
"1046","http://www.remax-svijetnekretnina.com/stan/tar-stan-s-okucnicom-i-pogledom-na-more","Tar, Tar-Vabriga","Stan/Apartman",3,NA,3,"104.900 € (778.969 kn)","55 m2","u vlasništvu","2003 god.","dovršena","U izradi","ne","ne znam","namještena","","","","","","da","1","ne","ne","ne","da","","više od 1km","Ne","TAR-stan s okućnicom i pogledom na more (ID: 300391007-181)","
                        Prodaje se ovaj simpatičan stan, smješten na odličnoj lokaciji u Taru.  Udaljen je oko 2,5km od mora. Stan se nalazi u visokom prizemlju zgrade te je površine 55m2. 
Sastoji se od dnevnog boravka, kupaonice, blagavaone, kuhinje, spavaće sobe, prostrane terase te lijepo uređenog dvorišta površine oko 50 m2.
Postoji mogućnost da se blagavaona prenamjeni u još jednu spavaću sobu ukoliko je to potrebno. Sa terase se pruža prekrasan, otvoreni pogled na more i Alpe.
Također mu pripada i spremište u podrumu veličine 9m2 te jedno parkirno mjesto.                    ","['Spremište', 'Balkon/lođa/terasa', 'Klima uređaj', 'Struja', 'Voda', 'Struja', 'otvoren pogled', 'Pogled - prekrasan!', 'Jug', 'Zapad', 'U blizini centra', 'U blizini glavne ceste / autoputa', 'U mirnoj ulici', 'U blizini javnog prijevoza', 'U blizini škole/vrtića/igrališta', 'U blizini trgovine', 'U blizini crkve', 'U blizini mora/plaže', 'U blizini parka/šume']",1,1,"8 m2","nema","nema"
"1058","http://www.remax-svijetnekretnina.com/apartman/istra-barbariga-apartman-sa-velikom-terasom","Barbariga, Vodnjan","Stan/Apartman",3,NA,1,"51.900 € (385.400 kn)","27 m2","zajednička na korištenje","1990 god.","dovršena","U izradi","ne","ne","namještaj po dogovoru","","","","","","da","1","ne","","ne","ne","","300-500m","Ne","Istra Barbariga, apartman sa velikom terasom (ID: 300041090-31)","
                        Istra Barbariga, prodaje se apartman na prvo katu zgrade, sa pakrirnim mjestom u Barbarigi površine 27m2. Apartman se sastoji od kuhinje, kupaone, i spavaće sobe sa galerijom.
 Apartman ima i veliku terasu površine 15m2.  Apartman se nalazi na katu a sastoji od kuhinje kupaone i sobe sa galerijom.
","['Kupaonica sa prozorom', 'Galerija', 'Kuhinja', 'Kuhinja sa prozorom', 'Balkon/lođa/terasa', 'Struja', 'Voda', 'Komunalije', 'Klasično', 'Struja', 'djelomično otvoren pogled', 'Jug', 'U mirnoj ulici', 'U blizini trgovine', 'U blizini mora/plaže', 'U blizini parka/šume']",1,NA,"15 m2","","nema"
"1061","http://www.remax-svijetnekretnina.com/stan/istra-umag-garsonijera-sa-panoramskim-pogledom-na-more","Umag","Stan/Apartman",1,NA,4,"48.500 € (360.152 kn)","22,76 m2","nema okućnice","1985 god.","dovršena","Izuzeto od obveze","ne","ne","namještena","","","","","","da","1","ne","","ne","da","","100-300m","Ne","Istra, Umag garsonijera sa panoramskim pogledom na more (ID: 300441007-75)","
                        Umag, garsonijera veličine 23m, na 3.katu stambene zgrade u neposrednoj blizini samoga centra. Lokacija nekretnine je nadomak svih bitnih sadržaja, te svega 150m udaljenosti od mora. Garsonijera je koncepirana od ulaznog hodnika, kuhinje, dnevnoga boravka koji je ujedno i spavaonica te kupaonice i zatvorenoga balkona sa kojeg se pruža panoramski pogled na more. Nekretnini pripada i drvarnica u prizemlju zgrade, te dodatno i zajednička ostava koja ima 20m. Nekretnina se prodaje namještena.                    ","['Kupaonica sa prozorom', 'Kuhinja', 'Spremište', 'Hodnik', 'Balkon/lođa/terasa', 'Klasično', 'Struja', 'Drva', 'Peleti', 'otvoren pogled', 'Jug', 'Istok', 'Centar', 'U blizini glavne ceste / autoputa', 'U mirnoj ulici', 'U blizini javnog prijevoza', 'U blizini škole/vrtića/igrališta', 'U blizini trgovine', 'U blizini bolnice', 'U blizini crkve', 'U blizini mora/plaže', 'U blizini parka/šume']",NA,1,"4 m2","","nema"
